{
  "company_code": "shortname",
  "environment": "prod",
  "hyperv_host": "hyperv_prod1",
  "vlan_id": 123,
  "vm_app_name": "MYCC-SHORTNAME-APP",
  "vm_db_name": "MYCC-SHORTNAME-DB",
  "vm_api_name": "MYCC-SHORTNAME-API",
  "vm_app_ip": "10.12.123.10",
  "vm_db_ip": "10.12.123.11",
  "vm_api_ip": "10.12.123.12",
  "vm_app_cpu": 4,
  "vm_app_memory": 8192,
  "vm_db_cpu": 8,
  "vm_db_memory": 16384,
  "vm_api_cpu": 4,
  "vm_api_memory": 8192,
  "vm_app_disk": 100,
  "vm_db_disk": 200,
  "vm_api_disk": 100,
  "network_gateway": "10.12.123.1",
  "network_dns": "10.12.0.1",
  "network_subnet": "255.255.255.0",
  "domain_name": "shortname.mycarecrm.com.au",
  "api_domain_name": "api-shortname.mycarecrm.com.au"
}
